{
  "title": "Bosses",
  "titleAs": "h2",
  "collapsed": true,
  "rowId": "id",
  "columns": [
    { "key": "boss", "header": "Boss", "link": { "hrefKey": "url", "external": true } },
    { "key": "location", "header": "Location" }
  ],
  "rows": [
    { "id": "dagannoth-kings", "boss": "Dagannoth Kings", "location": "Waterbirth Island Dungeon", "url": "https://runescape.wiki/w/Dagannoth_Kings" }
  ]
}
