{
  "title": "Wilderness Utility Upgrades",
  "titleAs": "h3",
  "collapsed": true,
  "rowId": "id",
  "columns": [
    { "key": "tier", "header": "Tier", "width": "sm", "emphasis": true, "wrap": false },
    { "key": "item", "header": "Item", "link": { "hrefKey": "url", "external": true } }
  ],
  "rows": [
    { "id": "bonecrusher", "tier": "Utility", "item": "Bonecrusher", "url": "https://runescape.wiki/w/Bonecrusher", "info":"Unlocked for free as a Tier 4 relic passive." },
    { "id": "charming-imp", "tier": "Utility", "item": "Charming Imp", "url": "https://runescape.wiki/w/Charming_Imp", "info":"Unlocked for free as a Tier 4 relic passive."},
    { "id": "herbicide", "tier": "Utility", "item": "Herbicide", "url": "https://runescape.wiki/w/Herbicide", "info":"Unlocked for free as a Tier 4 relic passive." },
    { "id": "gem-bag-upgraded", "tier": "Utility", "item": "Gem bag (upgraded)", "url": "https://runescape.wiki/w/Gem_bag_(upgraded)" }
  ]
}
