{
  "title": "Ability Upgrades",
  "titleAs": "h3",
  "collapsed": true,
  "sortable": true,
  "rowId": "id",
  "search": { "label": "Search Desert ability upgrades", "placeholder": "Search Desert ability upgrades..." },
  "emptyMessage": "No Desert ability upgrades match those filters.",
  "columns": [
    { "key": "item", "header": "Ability", "link": { "hrefKey": "url", "external": true }, "info": true },
    { "key": "level", "header": "Level", "filter": true, "width": "sm", "emphasis": true, "wrap": false },
    { "key": "style", "header": "Combat style", "filter": true, "width": "md", "wrap": false },
    { "key": "source", "header": "Source", "filter": true, "width": "md", "wrap": false }
  ],
  "rows": [
    { "id": "storm-shards", "item": "Storm Shards", "level": "70", "style": "Constitution", "source": "Liberation of Mazcab", "url": "https://runescape.wiki/w/Mazcab_ability_codex" },
    { "id": "shatter", "item": "Shatter", "level": "70", "style": "Constitution", "source": "Liberation of Mazcab", "url": "https://runescape.wiki/w/Mazcab_ability_codex" },
    { "id": "onslaught", "item": "Onslaught", "level": "90", "style": "Constitution", "source": "Liberation of Mazcab", "url": "https://runescape.wiki/w/Mazcab_ability_codex" },
    { "id": "corruption-shot", "item": "Corruption Shot", "level": "70", "style": "Range", "source": "Liberation of Mazcab", "url": "https://runescape.wiki/w/Corruption_Shot" },
    { "id": "corruption-blast", "item": "Corruption Blast", "level": "70", "style": "Magic", "source": "Liberation of Mazcab", "url": "https://runescape.wiki/w/Mazcab_ability_codex" },
    { "id": "reprisal", "item": "Reprisal", "level": "85", "style": "Constitution", "source": "Telos", "url": "https://runescape.wiki/w/Reprisal_ability_codex" },
    { "id": "devotion", "item": "Devotion", "level": "1", "style": "Defence", "source": "Quests", "url": "https://runescape.wiki/w/Devotion_ability_codex" }
  ]
}
