{
  "title": "Features",
  "titleAs": "h2",
  "collapsed": true,
  "rowId": "id",
  "columns": [
    { "key": "feature", "header": "Feature", "link": { "hrefKey": "url", "external": true }, "hidden": true }
  ],
  "rows": [
    { "id": "ectofuntus", "feature": "Ectofuntus", "url": "https://runescape.wiki/w/Ectofuntus" },
    { "id": "slayer-tower", "feature": "Slayer Tower", "url": "https://runescape.wiki/w/Slayer_Tower" },
    { "id": "werewolf-skullball", "feature": "Werewolf Skullball", "url": "https://runescape.wiki/w/Werewolf_Skullball" },
    { "id": "werewolf-agility-course", "feature": "Werewolf Agility Course", "url": "https://runescape.wiki/w/Werewolf_Agility_Course" },
    { "id": "everlight-dig-site", "feature": "Everlight Dig Site", "url": "https://runescape.wiki/w/Everlight_Dig_Site" }
  ]
}
