{
  "title": "Features",
  "titleAs": "h2",
  "collapsed": true,
  "rowId": "id",
  "columns": [
    { "key": "feature", "header": "Feature", "link": { "hrefKey": "url", "external": true }, "hidden": true }
  ],
  "rows": [
    { "id": "harmonium-harps", "feature": "Harmonium Harps", "url": "https://runescape.wiki/w/Harmonium_Harps" },
    { "id": "guthixian-butterfly", "feature": "Guthixian Butterfly", "url": "https://runescape.wiki/w/Guthixian_butterfly" },
    { "id": "seren-stones", "feature": "Seren Stones", "url": "https://runescape.wiki/w/Seren_stone" },
    { "id": "cleansing-crystals", "feature": "Cleansing Crystals", "url": "https://runescape.wiki/w/Cleansing_crystal" },
    { "id": "seren-spells", "feature": "Seren Spells", "url": "https://runescape.wiki/w/Ancient_Magicks#Seren_combat_spells" },
    { "id": "seren-prayer", "feature": "Seren Prayer", "url": "https://runescape.wiki/w/Ancient_Curses#Seren_prayers" },
    { "id": "voice-of-seren", "feature": "Voice of Seren", "url": "https://runescape.wiki/w/Voice_of_Seren" },
    { "id": "hefin-agility-course", "feature": "Hefin Agility Course", "url": "https://runescape.wiki/w/Hefin_Agility_Course" },
    { "id": "prifddinas-waterfall-fishing", "feature": "Prifddinas Waterfall Fishing", "url": "https://runescape.wiki/w/Prifddinas_Waterfall_Fishing" },
    { "id": "prifddinas-crystal-chest", "feature": "Prifddinas Crystal Chest", "url": "https://runescape.wiki/w/Crystal_chest_(Prifddinas)" },
    { "id": "rush-of-blood", "feature": "Rush of Blood", "url": "https://runescape.wiki/w/Rush_of_Blood" }
  ]
}
